{
  "$schema": "https://json-schema.org/draft/2020-12/schema",
  "$id": "mdfiles://schemas/work-state.schema.json",
  "title": "mdfiles work state",
  "type": "object",
  "required": ["schemaVersion", "protocolVersion", "taskId", "contractFingerprint", "repositoryFingerprint", "phase", "selectedGuides", "completedSteps", "pendingSteps", "checks", "failures", "blockers", "lastUpdated"],
  "properties": {
    "schemaVersion": { "const": 1 },
    "protocolVersion": { "const": 1 },
    "taskId": { "type": "string", "minLength": 1 },
    "contractFingerprint": { "type": "string", "pattern": "^[a-f0-9]{64}$" },
    "repositoryFingerprint": {
      "type": "object",
      "required": ["branch", "head"],
      "properties": {
        "branch": { "oneOf": [{ "type": "string" }, { "type": "null" }] },
        "head": { "oneOf": [{ "type": "string" }, { "type": "null" }] }
      },
      "additionalProperties": false
    },
    "phase": { "type": "string", "minLength": 1 },
    "selectedGuides": { "type": "array", "items": { "type": "string" } },
    "completedSteps": { "type": "array", "items": { "type": "string" } },
    "pendingSteps": { "type": "array", "items": { "type": "string" } },
    "requiredArtifacts": {
      "type": "array",
      "items": {
        "type": "object",
        "required": ["path", "sha256"],
        "properties": {
          "path": { "type": "string", "minLength": 1 },
          "sha256": { "type": "string", "pattern": "^[a-f0-9]{64}$" }
        },
        "additionalProperties": false
      }
    },
    "checks": { "type": "array", "items": { "type": "object" } },
    "failures": { "type": "array", "items": { "type": "object" } },
    "blockers": { "type": "array", "items": { "type": "object" } },
    "lastUpdated": { "type": "string", "minLength": 1 },
    "previousPhase": { "type": "string" },
    "diagnosedHypothesis": { "type": "string", "minLength": 1 },
    "verificationEvidence": { "type": "array", "items": { "type": "object" } }
  },
  "additionalProperties": false
}
