{
  "schemaVersion": 1,
  "protocolVersion": 1,
  "taskId": "fixture",
  "contractFingerprint": "aaaaaaaaaaaaaaaaaaaaaaaaaaaaaaaaaaaaaaaaaaaaaaaaaaaaaaaaaaaaaaaa",
  "repositoryFingerprint": {
    "branch": "fixture",
    "head": "fixture"
  },
  "phase": "RECEIVED",
  "selectedGuides": [],
  "completedSteps": [],
  "pendingSteps": [],
  "checks": [],
  "failures": [],
  "blockers": [],
  "lastUpdated": "fixture"
}
